{
  "fixture_contract_version": "1.0",
  "fixture_id": "sysmon-event1-ordinary-notepad-001",
  "source_format": "wazuh_indexer_alert_hit_projection",
  "retrieval": {
    "query_ref": "fixture-query:sysmon-event1-c",
    "retrieved_at": "2026-01-15T01:05:00Z",
    "query_window": {
      "start": "2026-01-15T01:00:00Z",
      "end": "2026-01-15T01:05:00Z"
    }
  },
  "hit": {
    "_index": "wazuh-alerts-4.x-2026.01.15",
    "_id": "wazuh-fixture-document-c",
    "_source": {
      "timestamp": "2026-01-15T01:04:04Z",
      "agent": {
        "id": "001",
        "name": "WIN-FIXTURE01"
      },
      "manager": {
        "name": "WAZUH-FIXTURE01"
      },
      "data": {
        "win": {
          "system": {
            "providerName": "Microsoft-Windows-Sysmon",
            "providerGuid": "{44444444-4444-4444-4444-444444444444}",
            "eventID": "1",
            "version": "5",
            "level": "4",
            "task": "1",
            "opcode": "0",
            "keywords": "0x8000000000000000",
            "systemTime": "2026-01-15T01:04:03.123Z",
            "eventRecordID": "41003",
            "channel": "Microsoft-Windows-Sysmon/Operational",
            "computer": "WIN-FIXTURE01"
          },
          "eventdata": {
            "ruleName": "-",
            "utcTime": "2026-01-15 01:04:03.123",
            "processGuid": "{33333333-3333-3333-3333-333333333331}",
            "processId": "4300",
            "image": "C:\\Windows\\System32\\notepad.exe",
            "fileVersion": "10.0.0.0",
            "description": "Synthetic Notepad fixture",
            "product": "Synthetic Windows fixture",
            "company": "Example Lab",
            "originalFileName": "NOTEPAD.EXE",
            "commandLine": "notepad.exe C:\\LabFixture\\readme.txt",
            "currentDirectory": "C:\\LabFixture\\",
            "user": "LAB\\fixture-user",
            "logonGuid": "{33333333-3333-3333-3333-333333333333}",
            "logonId": "0x123ABC",
            "terminalSessionId": "1",
            "integrityLevel": "Medium",
            "hashes": "SHA256=CCCCCCCCCCCCCCCCCCCCCCCCCCCCCCCCCCCCCCCCCCCCCCCCCCCCCCCCCCCCCCCC",
            "parentProcessGuid": "{33333333-3333-3333-3333-333333333332}",
            "parentProcessId": "3900",
            "parentImage": "C:\\Windows\\explorer.exe",
            "parentCommandLine": "explorer.exe",
            "parentUser": "LAB\\fixture-user"
          }
        }
      }
    }
  }
}
